{
  "$schema": "http://json-schema.org/draft-07/schema#",
  "properties": {
    "description": {
      "type": "string"
    },
    "id": {
      "type": "string"
    },
    "location": {
      "type": "string"
    },
    "name": {
      "type": "string"
    },
    "source": {
      "items": {
        "type": "string"
      },
      "type": "array"
    },
    "version": {
      "type": "string"
    }
  },
  "required": [
    "description",
    "id",
    "location",
    "name",
    "source",
    "version"
  ],
  "type": "object",
  "additionalProperties": false
}