{
  "id": "Cecilia",
  "name": "Cecilia",
  "description": "Un fiore dall'aspetto incantevole che cresce solo nei luoghi dove soffiano i venti pi√π forti. Intangibile come il cuore puro di un'anima libera.",
  "source": [
    "Consiglio: si trova sul Promontorio Acchiappastelle",
    "Vai a raccogliere"
  ],
  "location": "Mondstadt",
  "version": "5.0"
}