{
  "id": "ClearwaterJade",
  "name": "Clearwater Jade",
  "description": "หยกที่เกิดบนหุบเขา Chenyu สัมผัสเย็นราวกับน้ำบริสุทธิ์ นั่นจึงเป็นที่มาของชื่อนี้",
  "source": [
    "พบได้ในโลกกว้าง",
    "คำแนะนำ: หาได้ที่บริเวณ Chenyu Vale: Southern Mountain",
    "พบได้ในโลกกว้าง",
    "คำแนะนำ: หาได้ที่บริเวณ Chenyu Vale: Southern Mountain",
    "ไปเก็บ"
  ],
  "location": "Liyue",
  "version": "4.4"
}