{
  "id": "Violetgrass",
  "name": "Campanita de cristal",
  "description": "Una pequeña flor con mucha vitalidad. Se dice que se abre hacia abajo para impedir que su fragancia se escape.",
  "source": [
    "Recolectar en peñascos de Liyue",
    "Recolectar"
  ],
  "location": "Liyue",
  "version": "5.0"
}