{
  "id": "SubdetectionUnit",
  "name": "Subdetection Unit",
  "description": "Detection units produced by Fontaine Research Institute using new models of artificed components. Its original purpose was monitoring all kinds of environmental data.",
  "source": [
    "Found in the wild",
    "Recommendation:Found in Fontaine Research Institute of Kinetic Energy Engineering Region",
    "Recommendation: Found in Fontaine Research Institute of Kinetic Energy Engineering Region",
    "Go to collect"
  ],
  "location": "Fontaine",
  "version": "5.0"
}